{
  "schema_version": "0.1.0",
  "dataset_name": "SWE-bench/SWE-bench_Verified",
  "dataset_split": "test",
  "instance_id": "psf__requests-1724",
  "repo": "psf/requests",
  "base_commit": "1ba83c47ce7b177efe90d5f51f7760680f72eda0",
  "changed_source_files": [
    "requests/sessions.py"
  ],
  "changed_test_files": [
    "test_requests.py"
  ],
  "changed_test_support_files": [],
  "regression_surface_strength": "high",
  "test_signal": {
    "level": "high",
    "rationale": "Gold preflight passed the official target split: 6 FAIL_TO_PASS and 79 PASS_TO_PASS.",
    "evidence": [
      "pytest -rA test_requests.py"
    ]
  },
  "conditions": {
    "type_hints": {
      "condition": "type_hints",
      "status": "GO",
      "signal": {
        "level": "low",
        "rationale": "Target surface has 0 annotation nodes.",
        "evidence": [
          "requests/sessions.py",
          "test_requests.py"
        ]
      },
      "fairness_notes": [
        "Strip only target Python files."
      ],
      "blockers": []
    },
    "naming": {
      "condition": "naming",
      "status": "GO",
      "signal": {
        "level": "high",
        "rationale": "Target surface has 317 local rename candidates before safety filtering.",
        "evidence": [
          "requests/sessions.py",
          "test_requests.py"
        ]
      },
      "fairness_notes": [
        "Use scope-limited Rope renames and preserve public/test discovery names."
      ],
      "blockers": []
    },
    "comments_docstrings": {
      "condition": "comments_docstrings",
      "status": "GO",
      "signal": {
        "level": "high",
        "rationale": "Target surface has 29 docstrings and 90 comments.",
        "evidence": [
          "requests/sessions.py",
          "test_requests.py"
        ]
      },
      "fairness_notes": [
        "Strip only comments/docstrings in source-like target files."
      ],
      "blockers": []
    },
    "remove_tests": {
      "condition": "remove_tests",
      "status": "GO",
      "signal": {
        "level": "high",
        "rationale": "Gold preflight passed 6 FAIL_TO_PASS and 79 PASS_TO_PASS targets.",
        "evidence": [
          "test_requests.py"
        ]
      },
      "fairness_notes": [
        "Delete changed test files only; official oracle restores tests during replay."
      ],
      "blockers": []
    }
  },
  "overall_status": "GO",
  "eligible_conditions": [
    "type_hints",
    "naming",
    "comments_docstrings",
    "remove_tests"
  ],
  "chosen_pilot_condition": null,
  "decision_summary": "Selected as a psf/requests task for the next Phase 1 repo after signal screening and successful host-local gold preflight.",
  "evidence_sources": [
    {
      "type": "signal_screen",
      "path": "archive/provenance/archive/provenance/dev/active/bootstrap-2026-04-22/psf_requests_signal_screen_2026-04-27.json"
    },
    {
      "type": "gold_preflight",
      "path": "archive/provenance/archive/provenance/dev/active/bootstrap-2026-04-22/psf__requests-1724_gold_preflight_result.json"
    },
    {
      "type": "snapshot",
      "path": "archive/provenance/archive/provenance/dev/active/bootstrap-2026-04-22/psf__requests-1724_snapshot.json"
    }
  ],
  "open_questions": [],
  "notes": []
}
